{
  "$schema": "https://json-schema.org/draft/2020-12/schema",
  "title": "Mount pool registry",
  "type": "object",
  "required": [
    "name",
    "owner_id",
    "owner_type",
    "records",
    "runtime",
    "schema"
  ],
  "properties": {
    "name": {
      "type": "string"
    },
    "owner_id": {
      "type": "string"
    },
    "owner_type": {
      "type": "string"
    },
    "records": {
      "type": "array"
    },
    "runtime": {
      "type": "object"
    },
    "schema": {
      "type": "string"
    }
  },
  "additionalProperties": true,
  "description": "Current schema contract."
}
