{"name":"Settlements, Demography, and Recruitment","owner_id":"population_tang_manor","owner_type":"population_registry","records":[{"facts":{"Contracted outer-defense population":"7500 anonymous personnel plus one separate named Contract Marshal","Sword Manor provisional residential trainee population":5000,"Tang Manor permanent population":9600,"contracted outer-defense barracks capacity":8000,"emergency total supported population before temporary field-camp expansion":23301,"maximum ordinary visitors outside residents, trainees, and contracted defenders":1200,"trainee residential campus capacity":6000},"label":"Overview","record_id":"overview"},{"facts":{"population_distribution":{"agricultural":1800,"forge_armory":250,"stable_remount_carriage":220,"warehouse_granary":250,"construction_maintenance":300,"household_service":300,"sword_manor_civil_medical":50,"administration_records":180,"water_sanitation_firefighting":180,"dependents_children":1255},"named_department_leadership_count":6,"House Tang direct outside recruitment":"prohibited","Permanent civil household dependent and named department leadership total":4791,"Permanent martial and institutional core including family":4809,"Permanent total":9600,"Provisional Sword Manor trainees":5000,"Sword Manor intake maximum per 30-day cycle":"500 candidates","Sword Manor trainee target floor":5000,"Sword Manor trainee target rule":"maintain at least 125 percent of the largest other Sword Manor anonymous rank, rounded upward to 100, and never below 5000 when housing, food, instructors, and treasury permit","civil_department_cell_rule":"each civil department remains one aggregate population stratum until a real task creates a temporary work party; the 50 Sword Manor medical and infirmary staff are civilian camp support and never troop units or command slots","minimum lawful state conscription age":16,"minimum voluntary House Tang battlefield service age":"10 only for Tang Kai under the protected-family exception","minimum voluntary Sword Manor trainee enrollment age":12},"label":"Whole-department civil population","notes":["Current Junior Disciples who meet field qualification and issue requirements are combat-capable and available for legal deployment. Trainees are not field-qualified and may fight only in immediate local self-defense until promoted to Junior Disciple.","Sword Manor acceptance requires total allegiance, information exclusivity, and martial exclusivity for the term of enrollment.","Fifty Sword Manor physicians, healers, orderlies and evacuation staff are civilian medical/camp-support population under the occupied Chief Physician role's professional medical authority when assigned. They do not belong to Sword Manor military manpower, do not form units, do not take command slots, and are exposed to casualties only through actual camp, treatment-site or evacuation-chain danger."],"record_id":"whole_department_civil_units"}],"runtime":{"last_settled_at":"245-BCE-12-02T06:00:00+08:00"},"schema":"population-registry"}
