{
  "name": "Internal Unit Full Combat Sheets",
  "owner_id": "internal_unit_combat_kernels",
  "owner_type": "combat_kernel_registry",
  "records": [
    {
      "facts": {
        "attribute_order": ["Strength","Agility","Endurance","Toughness","Coordination","Awareness","Composure","Intelligence","Presence"],
        "character_lite_rule": "Any materialized individual-lite person is a persistent named person with one exact nine-attribute array, one exact 35-skill array, combat specializations, health, fatigue, equipment and history. It never substitutes a unit mean for its own values and keeps the same identity if promoted to full exact state.",
        "combat_cache_rule": "copy these values, then apply health, fatigue, experience execution, morale, cohesion, equipment condition, terrain, command, and temporary effects exactly once",
        "qualification_application": "legal-role and equipment gate only; never multiply permanent attribute or skill means",
        "skill_order": ["Sword","Spear","Glaive","Axe","Mace","Staff","Dagger","Bow","Crossbow","Shield","Defense","Athletics","Mass Combat","Grappling","Unarmed","Riding","Formation Fighting","Survival","Stealth","Scouting","Navigation","Medicine","Engineering","Leadership","Formation Command","Tactics","Strategy","Logistics","Intelligence Operations","Training","Diplomacy","Law","Trade","Intrigue","Governance"]
      },
      "label": "Overview",
      "notes": ["Every combat-capable unit stores the complete permanent stat arrays used by a full-sheet character. The arrays are current final means, not targets, minimums, or pre-qualification values. No omitted skill default is permitted in unit combat. Biography, personal relationships, appearance, names, and other noncombat character fields are absent.","Tang Wei's personally owned exact/individual-lite retinue is excluded from unit-mean authority. Its named people resolve from their own saved sheets even when organized into player-created units."],
      "record_id": "overview"
    },
    {
      "facts": {
        "attribute_values": [112,115,122,116,118,115,120,92,98],
        "combat_specializations": "Heavy Cavalry Charge 145; Mounted Great War Bow 130; Household Formation 140",
        "display": "House Guardian Cavalry",
        "fatigue_mean": 0,
        "full_draw_great_war_qualified_count": 300,
        "headcount": 300,
        "health_distribution_owner": "owner:unit_training_contracts",
        "loadout": "loadout_house_guardian_cavalry",
        "mount_type": "horse_tang_heavy_war",
        "primary_bow": "weapon_bow_great_war",
        "skill_values": [120,135,80,70,70,75,85,120,70,130,145,135,120,95,90,150,140,115,85,115,105,55,60,100,100,98,75,95,70,90,55,45,55,50,45]
      },
      "label": "force_house_guardian_cavalry",
      "record_id": "force_house_guardian_cavalry"
    },
    {
      "facts": {
        "attribute_values": [105,95,112,110,102,104,114,86,92],
        "combat_specializations": "Gate Defense 145; Shieldwall 145; Great War Bow Volley 120",
        "display": "House Guards",
        "fatigue_mean": 0,
        "full_draw_great_war_qualified_count": 700,
        "headcount": 700,
        "health_distribution_owner": "owner:unit_training_contracts",
        "loadout": "loadout_house_guard",
        "mount_type": null,
        "primary_bow": "weapon_bow_great_war",
        "skill_values": [125,110,85,95,100,90,90,110,95,140,145,125,115,110,100,70,145,85,70,80,75,50,65,92,95,90,68,90,75,85,50,80,45,65,55]
      },
      "label": "force_house_guards",
      "record_id": "force_house_guards"
    },
    {
      "facts": {
        "attribute_values": [115,112,120,114,118,116,124,110,116],
        "combat_specializations": "Formation Instruction 145; Escort Command 135; Mounted Great War Bow 125",
        "display": "Sword Manor Officers",
        "fatigue_mean": 0,
        "full_draw_great_war_qualified_count": 50,
        "headcount": 50,
        "health_distribution_owner": "owner:unit_training_contracts",
        "loadout": "loadout_house_guardian_cavalry",
        "mount_type": "horse_tang_heavy_war",
        "primary_bow": "weapon_bow_great_war",
        "skill_values": [145,125,110,85,85,100,105,120,95,125,145,130,125,105,100,120,145,105,85,105,100,70,80,125,120,120,105,105,90,125,75,70,65,70,75]
      },
      "label": "SM-O-01",
      "record_id": "sm_o_01"
    },
    {
      "facts": {
        "attribute_values": [105,104,112,106,108,106,112,92,96],
        "combat_specializations": "Senior Disciple Formation 135; Great War Bow Volley 120; Junior Instruction 105",
        "display": "Sword Manor Senior Disciples",
        "fatigue_mean": 0,
        "full_draw_great_war_qualified_count": 150,
        "headcount": 150,
        "health_distribution_owner": "owner:unit_training_contracts",
        "loadout": "loadout_house_guard",
        "mount_type": null,
        "primary_bow": "weapon_bow_great_war",
        "skill_values": [125,110,95,80,80,95,95,115,85,120,135,130,110,95,90,90,135,95,80,90,85,55,60,95,85,90,70,75,60,90,55,50,50,50,55]
      },
      "label": "SM-S",
      "record_id": "sm_s"
    },
    {
      "facts": {
        "attribute_values": [92,92,100,94,96,92,98,78,82],
        "combat_specializations": "Professional Formation 105; Heavy War Bow Volley 95",
        "display": "Sword Manor General Disciples",
        "fatigue_mean": 0,
        "full_draw_heavy_war_qualified_count": 1500,
        "headcount": 1500,
        "health_distribution_owner": "owner:unit_training_contracts",
        "loadout": "loadout_sword_manor_standard",
        "mount_type": null,
        "primary_bow": "weapon_bow_heavy_war",
        "skill_values": [95,90,78,70,70,78,80,90,75,95,105,100,80,75,72,70,105,80,65,70,68,45,50,70,65,65,48,60,45,55,45,40,45,42,45]
      },
      "label": "SM-G",
      "record_id": "sm_g"
    },
    {
      "facts": {
        "attribute_values": [84,86,92,87,88,84,90,70,74],
        "combat_specializations": "Basic Combat Formation 76; Heavy War Bow Volley 72",
        "display": "Sword Manor Junior Disciples",
        "fatigue_mean": 0,
        "full_draw_heavy_war_qualified_count": 2000,
        "headcount": 2000,
        "health_distribution_owner": "owner:unit_training_contracts",
        "loadout": "loadout_sword_manor_standard",
        "mount_type": null,
        "primary_bow": "weapon_bow_heavy_war",
        "skill_values": [72,68,55,50,50,60,62,68,55,72,78,82,55,58,60,55,76,62,55,58,55,35,38,42,35,38,28,40,30,35,32,28,32,30,30]
      },
      "label": "SM-J",
      "record_id": "sm_j"
    },
    {
      "facts": {
        "attribute_values": [92,116,108,92,118,124,110,88,90],
        "combat_specializations": "Rapid Reconnaissance 135; Reconnaissance Evasion 130; Mounted Heavy Bow 115",
        "display": "Sword Manor Mounted Scouts",
        "fatigue_mean": 0,
        "full_draw_heavy_war_qualified_count": 50,
        "headcount": 50,
        "health_distribution_owner": "owner:unit_training_contracts",
        "loadout": "loadout_sword_manor_mounted_scouts",
        "mount_type": "horse_tang_swift_war",
        "primary_bow": "weapon_bow_heavy_war",
        "skill_values": [90,85,55,50,50,65,95,105,85,80,100,115,70,75,75,110,90,120,115,130,125,55,45,70,55,75,55,70,95,60,50,40,55,80,40]
      },
      "label": "SM-C-01",
      "record_id": "sm_c_01"
    },
    {
      "facts": {
        "attribute_values": [58,56,64,60,58,56,58,48,48],
        "combat_specializations": "Trainee Drill 48; Composite Bow Fundamentals 46; Basic Shield Line 50",
        "display": "Sword Manor Trainees",
        "fatigue_mean": 0,
        "field_deployment_status": "not field-qualified; local emergency self-defense only",
        "full_draw_composite_qualified_count": 5000,
        "headcount": 5000,
        "health_distribution_owner": "owner:unit_training_contracts",
        "loadout": "loadout_sword_manor_trainee",
        "mount_type": null,
        "primary_bow": "weapon_bow_composite",
        "skill_values": [48,52,35,35,35,45,42,44,38,50,52,56,38,40,42,30,48,45,38,40,38,20,22,24,18,20,14,22,18,18,20,18,20,18,16],
        "source_quality_rule": "seed mean is derived from the conserved intake distribution and is intentionally below ordinary external line infantry"
      },
      "label": "SM-T",
      "record_id": "sm_t"
    }
  ],
  "runtime": {"last_settled_at": "245-BCE-12-02T06:00:00+08:00"},
  "schema": "combat-kernel-registry.v38"
}
